{
  "record_id": "ver-00311",
  "record_type": "VER",
  "schema_version": "0.1.0",
  "timestamp": "2026-08-23T19:27:21Z",
  "linked_record_id": "der-00311",
  "linked_record_hash": "6c33baadafd39bcbe354b3f9cd9f3c836eadb5c7a839f46db1c500bcd657c6cd",
  "verification_type": "internal_QA_review",
  "verification_status": "SUBPROCESSOR_PENDING",
  "subprocessor_update": "Subprocessor deletion confirmation still outstanding at time of review (synthetic).",
  "evidence_metadata": {
    "recorded_by_reference": "reviewer-ref-35dd085",
    "recorded_at": "2026-08-23T23:19:43Z",
    "evidence_references": [
      "review-000311"
    ],
    "canonicalization_method": "der-ver-canonical-json-v0.1",
    "record_hash": "ea0ef2c402a3b132ba672caab32838d525038e096d6bb38c3b5dd6bf4c5a3989"
  }
}
