{
  "record_id": "ver-00290",
  "record_type": "VER",
  "schema_version": "0.1.0",
  "timestamp": "2026-08-23T10:30:11Z",
  "linked_record_id": "der-00290",
  "linked_record_hash": "de61c27580dbc2dea71be087d9f7ce23490e58fa3828ff3c012c8f051419b9a7",
  "verification_type": "internal_QA_review",
  "verification_status": "CONFIRMED",
  "evidence_metadata": {
    "recorded_by_reference": "reviewer-ref-26d69ec",
    "recorded_at": "2026-08-22T22:11:57Z",
    "evidence_references": [
      "review-000290"
    ],
    "canonicalization_method": "der-ver-canonical-json-v0.1",
    "record_hash": "290cf429b1166349e7d630fac4c298ae432fb721a5345ab0d5bb4e84094aedac"
  }
}
